1501.00601,0,We propose that Solomonoff induction is complete in the physical sense via several strong physical arguments. We also argue that Solomonoff induction is fully applicable to quantum mechanics. We show how to choose an objective reference machine for universal induction by defining a physical message complexity and physical message probability, and argue that this choice dissolves some well-known objections to universal induction. We also introduce many more variants of physical message complexity based on energy and action, and discuss the ramifications of our proposals.
1501.00653,0,In the recent years, the problem of identifying suspicious behavior has gained importance and identifying this behavior using computational systems and autonomous algorithms is highly desirable in a tactical scenario. So far, the solutions have been primarily manual which elicit human observation of entities to discern the hostility of the situation. To cater to this problem statement, a number of fully automated and partially automated solutions exist. But, these solutions lack the capability of learning from experiences and work in conjunction with human supervision which is extremely prone to error. In this paper, a generalized methodology to predict the hostility of a given object based on its movement patterns is proposed which has the ability to learn and is based upon the mechanism of humans of learning from experiences. The methodology so proposed has been implemented in a computer simulation. The results show that the posited methodology has the potential to be applied in real world tactical scenarios.
1501.01178,0,The goal of constraint-based sequence mining is to find sequences of symbols that are included in a large number of input sequences and that satisfy some constraints specified by the user. Many constraints have been proposed in the literature, but a general framework is still missing. We investigate the use of constraint programming as general framework for this task. We first identify four categories of constraints that are applicable to sequence mining. We then propose two constraint programming formulations. The first formulation introduces a new global constraint called exists-embedding. This formulation is the most efficient but does not support one type of constraint. To support such constraints, we develop a second formulation that is more general but incurs more overhead. Both formulations can use the projected database technique used in specialised algorithms. Experiments demonstrate the flexibility towards constraint-based settings and compare the approach to existing methods.
1501.01239,0,In this paper, we establish some theoretical connections between Sum-Product Networks (SPNs) and Bayesian Networks (BNs). We prove that every SPN can be converted into a BN in linear time and space in terms of the network size. The key insight is to use Algebraic Decision Diagrams (ADDs) to compactly represent the local conditional probability distributions at each node in the resulting BN by exploiting context-specific independence (CSI). The generated BN has a simple directed bipartite graphical structure. We show that by applying the Variable Elimination algorithm (VE) to the generated BN with ADD representations, we can recover the original SPN where the SPN can be viewed as a history record or caching of the VE inference process. To help state the proof clearly, we introduce the notion of {\em normal} SPN and present a theoretical analysis of the consistency and decomposability properties. We conclude the paper with some discussion of the implications of the proof and establish a connection between the depth of an SPN and a lower bound of the tree-width of its corresponding BN.
1501.01252,0,This paper proposes a new method to provide personalized tour recommendation for museum visits. It combines an optimization of preference criteria of visitors with an automatic extraction of artwork importance from museum information based on Natural Language Processing using textual energy. This project includes researchers from computer and social sciences. Some results are obtained with numerical experiments. They show that our model clearly improves the satisfaction of the visitor who follows the proposed tour. This work foreshadows some interesting outcomes and applications about on-demand personalized visit of museums in a very near future.
1501.01432,0,Evidential-EM (E2M) algorithm is an effective approach for computing maximum likelihood estimations under finite mixture models, especially when there is uncertain information about data. In this paper we present an extension of the E2M method in a particular case of incom-plete data, where the loss of information is due to both mixture models and censored observations. The prior uncertain information is expressed by belief functions, while the pseudo-likelihood function is derived based on imprecise observations and prior knowledge. Then E2M method is evoked to maximize the generalized likelihood function to obtain the optimal estimation of parameters. Numerical examples show that the proposed method could effectively integrate the uncertain prior infor-mation with the current imprecise knowledge conveyed by the observed data.
1501.01457,0,In this paper, we study the impact of selection methods in the context of on-line on-board distributed evolutionary algorithms. We propose a variant of the mEDEA algorithm in which we add a selection operator, and we apply it in a taskdriven scenario. We evaluate four selection methods that induce different intensity of selection pressure in a multi-robot navigation with obstacle avoidance task and a collective foraging task. Experiments show that a small intensity of selection pressure is sufficient to rapidly obtain good performances on the tasks at hand. We introduce different measures to compare the selection methods, and show that the higher the selection pressure, the better the performances obtained, especially for the more challenging food foraging task.
1501.01460,0,Median clustering is of great value for partitioning relational data. In this paper, a new prototype-based clustering method, called Median Evidential C-Means (MECM), which is an extension of median c-means and median fuzzy c-means on the theoretical framework of belief functions is proposed. The median variant relaxes the restriction of a metric space embedding for the objects but constrains the prototypes to be in the original data set. Due to these properties, MECM could be applied to graph clustering problems. A community detection scheme for social networks based on MECM is investigated and the obtained credal partitions of graphs, which are more refined than crisp and fuzzy ones, enable us to have a better understanding of the graph structures. An initial prototype-selection scheme based on evidential semi-centrality is presented to avoid local premature convergence and an evidential modularity function is defined to choose the optimal number of communities. Finally, experiments in synthetic and real data sets illustrate the performance of MECM and show its difference to other methods.
1501.01501,0,Autonomously detecting and recovering from faults is one approach for reducing the operational complexity and costs associated with managing computing environments. We present a novel methodology for autonomously generating investigation leads that help identify systems faults, and extends our previous work in this area by leveraging Restricted Boltzmann Machines (RBMs) and contrastive divergence learning to analyse changes in historical feature data. This allows us to heuristically identify the root cause of a fault, and demonstrate an improvement to the state of the art by showing feature data can be predicted heuristically beyond a single instance to include entire sequences of information.
1501.02560,0,In the data mining field many clustering methods have been proposed, yet standard versions do not take into account uncertain databases. This paper deals with a new approach to cluster uncertain data by using a hierarchical clustering defined within the belief function framework. The main objective of the belief hierarchical clustering is to allow an object to belong to one or several clusters. To each belonging, a degree of belief is associated, and clusters are combined based on the pignistic properties. Experiments with real uncertain data show that our proposed method can be considered as a propitious tool.
1501.02732,0,In educational technology and learning sciences, there are multiple uses for a predictive model of whether a student will perform a task correctly or not. For example, an intelligent tutoring system may use such a model to estimate whether or not a student has mastered a skill. We analyze the significance of data recency in making such predictions, i.e., asking whether relatively more recent observations of a student's performance matter more than relatively older observations. We develop a new Recent-Performance Factors Analysis model that takes data recency into account. The new model significantly improves predictive accuracy over both existing logistic-regression performance models and over novel baseline models in evaluations on real-world and synthetic datasets. As a secondary contribution, we demonstrate how the widely used cross-validation with 0-1 loss is inferior to AIC and to cross-validation with L1 prediction error loss as a measure of model performance.
1501.03093,0,We present MultiGain, a tool to synthesize strategies for Markov decision processes (MDPs) with multiple mean-payoff objectives. Our models are described in PRISM, and our tool uses the existing interface and simulator of PRISM. Our tool extends PRISM by adding novel algorithms for multiple mean-payoff objectives, and also provides features such as (i)~generating strategies and exploring them for simulation, and checking them with respect to other properties; and (ii)~generating an approximate Pareto curve for two mean-payoff objectives. In addition, we present a new practical algorithm for the analysis of MDPs with multiple mean-payoff objectives under memoryless strategies.
1501.03302,0,Progress in language and image understanding by machines has sparkled the interest of the research community in more open-ended, holistic tasks, and refueled an old AI dream of building intelligent machines. We discuss a few prominent challenges that characterize such holistic tasks and argue for "question answering about images" as a particular appealing instance of such a holistic task. In particular, we point out that it is a version of a Turing Test that is likely to be more robust to over-interpretations and contrast it with tasks like grounding and generation of descriptions. Finally, we discuss tools to measure progress in this field.
1501.03784,0,This article proposes the use of Vector Symbolic Architectures for implementing Hierarchical Graph Neuron, an architecture for memorizing patterns of generic sensor stimuli. The adoption of a Vector Symbolic representation ensures a one-layered design for the approach, while maintaining the previously reported properties and performance characteristics of Hierarchical Graph Neuron, and also improving the noise resistance of the architecture. The proposed architecture enables a linear (with respect to the number of stored entries) time search for an arbitrary sub-pattern.
1501.03959,0,This paper presents a way of solving Markov Decision Processes that combines state abstraction and temporal abstraction. Specifically, we combine state aggregation with the options framework and demonstrate that they work well together and indeed it is only after one combines the two that the full benefit of each is realized. We introduce a hierarchical value iteration algorithm where we first coarsely solve subgoals and then use these approximate solutions to exactly solve the MDP. This algorithm solved several problems faster than vanilla value iteration.
1501.04177,0,In this paper, we provide all information to participate to the Second International Nurse Rostering Competition (INRC-II). First, we describe the problem formulation, which, differently from INRC-I, is a multi-stage procedure. Second, we illustrate all the necessary infrastructure do be used together with the participant's solver, including the testbed, the file formats, and the validation/simulation tools. Finally, we state the rules of the competition. All update-to-date information about the competition is available at this http URL.
1501.04242,0,We survey concepts at the frontier of research connecting artificial, animal and human cognition to computation and information processing---from the Turing test to Searle's Chinese Room argument, from Integrated Information Theory to computational and algorithmic complexity. We start by arguing that passing the Turing test is a trivial computational problem and that its pragmatic difficulty sheds light on the computational nature of the human mind more than it does on the challenge of artificial intelligence. We then review our proposed algorithmic information-theoretic measures for quantifying and characterizing cognition in various forms. These are capable of accounting for known biases in human behavior, thus vindicating a computational algorithmic view of cognition as first suggested by Turing, but this time rooted in the concept of algorithmic probability, which in turn is based on computational universality while being independent of computational model, and which has the virtue of being predictive and testable as a model theory of cognitive behavior.
1501.04370,0,We study the Bayesian model averaging approach to learning Bayesian network structures (DAGs) from data. We develop new algorithms including the first algorithm that is able to efficiently sample DAGs according to the exact structure posterior. The DAG samples can then be used to construct estimators for the posterior of any feature. We theoretically prove good properties of our estimators and empirically show that our estimators considerably outperform the estimators from the previous state-of-the-art methods.
1501.04684,0,We introduce the first, general purpose, slice sampling inference engine for probabilistic programs. This engine is released as part of StocPy, a new Turing-Complete probabilistic programming language, available as a Python library. We present a transdimensional generalisation of slice sampling which is necessary for the inference engine to work on traces with different numbers of random variables. We show that StocPy compares favourably to other PPLs in terms of flexibility and usability, and that slice sampling can outperform previously introduced inference methods. Our experiments include a logistic regression, HMM, and Bayesian Neural Net.
1501.04786,0,In this paper, we propose to learn sources independence in order to choose the appropriate type of combination rules when aggregating their beliefs. Some combination rules are used with the assumption of their sources independence whereas others combine beliefs of dependent sources. Therefore, the choice of the combination rule depends on the independence of sources involved in the combination. 
In this paper, we propose also a measure of independence, positive and negative dependence to integrate in mass functions before the combinaision with the independence assumption.
1501.04795,0,Nowadays, social networks became essential in information exchange between individuals. Indeed, as users of these networks, we can send messages to other people according to the links connecting us. Moreover, given the large volume of exchanged messages, detecting the true nature of the received message becomes a challenge. For this purpose, it is interesting to consider this new tendency with reasoning under uncertainty by using the theory of belief functions. In this paper, we tried to model a social network as being a network of fusion of information and determine the true nature of the received message in a well-defined node by proposing a new model: the belief social network.
1501.04796,0,Understanding infant development is one of the greatest scientific challenges of contemporary science. A large source of difficulty comes from the fact that the development of skills in infants results from the interactions of multiple mechanisms at multiple spatio-temporal scales. The concepts of "innate" or "acquired" are not any more adequate tools for explanations, which call for a shift from reductionist to systemic accounts. To address this challenge, building and experimenting with robots modeling the growing infant brain and body is crucial. Systemic explanations of pattern formation in sensorimotor, cognitive and social development, viewed as a complex dynamical system, require the use of formal models based on mathematics, algorithms and robots. Formulating hypothesis about development using such models, and exploring them through experiments, allows us to consider in detail the interaction between many mechanisms and parameters. This complements traditional experimental methods in psychology and neuroscience where only a few variables can be studied at the same time. Furthermore, the use of robots is of particular importance. The laws of physics generate everywhere around us spontaneous patterns in the inorganic world. They also strongly impact the living, and in particular constrain and guide infant development through the properties of its (changing) body in interaction with the physical environment. Being able to consider the body as an experimental variable, something that can be systematically changed in order to study the impact on skill formation, has been a dream to many developmental scientists. This is today becoming possible with developmental robotics.
1501.05031,0,We present a new decision rule, \emph{maximin safety}, that seeks to maintain a large margin from the worst outcome, in much the same way minimax regret seeks to minimize distance from the best. We argue that maximin safety is valuable both descriptively and normatively. Descriptively, maximin safety explains the well-known \emph{decoy effect}, in which the introduction of a dominated option changes preferences among the other options. Normatively, we provide an axiomatization that characterizes preferences induced by maximin safety, and show that maximin safety shares much of the same behavioral basis with minimax regret.
1501.05272,0,The web plays an important role in people's social lives since the emergence of Web 2.0. It facilitates the interaction between users, gives them the possibility to freely interact, share and collaborate through social networks, online communities forums, blogs, wikis and other online collaborative media. However, an other side of the web is negatively taken such as posting inflammatory messages. Thus, when dealing with the online communities forums, the managers seek to always enhance the performance of such platforms. In fact, to keep the serenity and prohibit the disturbance of the normal atmosphere, managers always try to novice users against these malicious persons by posting such message (DO NOT FEED TROLLS). But, this kind of warning is not enough to reduce this phenomenon. In this context we propose a new approach for detecting malicious people also called 'Trolls' in order to allow community managers to take their ability to post online. To be more realistic, our proposal is defined within an uncertain framework. Based on the assumption consisting on the trolls' integration in the successful discussion threads, we try to detect the presence of such malicious users. Indeed, this method is based on a conflict measure of the belief function theory applied between the different messages of the thread. In order to show the feasibility and the result of our approach, we test it in different simulated data.
1501.05530,0,Speech Recognition searches to predict the spoken words automatically. These systems are known to be very expensive because of using several pre-recorded hours of speech. Hence, building a model that minimizes the cost of the recognizer will be very interesting. In this paper, we present a new approach for recognizing speech based on belief HMMs instead of proba-bilistic HMMs. Experiments shows that our belief recognizer is insensitive to the lack of the data and it can be trained using only one exemplary of each acoustic unit and it gives a good recognition rates. Consequently, using the belief HMM recognizer can greatly minimize the cost of these systems.
1501.05612,0,The aim of this paper is to show the interest in fitting features with an $\alpha$-stable distribution to classify imperfect data. The supervised pattern recognition is thus based on the theory of continuous belief functions, which is a way to consider imprecision and uncertainty of data. The distributions of features are supposed to be unimodal and estimated by a single Gaussian and $\alpha$-stable model. Experimental results are first obtained from synthetic data by combining two features of one dimension and by considering a vector of two features. Mass functions are calculated from plausibility functions by using the generalized Bayes theorem. The same study is applied to the automatic classification of three types of sea floor (rock, silt and sand) with features acquired by a mono-beam echo-sounder. We evaluate the quality of the $\alpha$-stable model and the Gaussian model by analyzing qualitative results, using a Kolmogorov-Smirnov test (K-S test), and quantitative results with classification rates. The performances of the belief classifier are compared with a Bayesian approach.
1501.05613,0,Hidden Markov Models (HMMs) are learning methods for pattern recognition. The probabilistic HMMs have been one of the most used techniques based on the Bayesian model. First-order probabilistic HMMs were adapted to the theory of belief functions such that Bayesian probabilities were replaced with mass functions. In this paper, we present a second-order Hidden Markov Model using belief functions. Previous works in belief HMMs have been focused on the first-order HMMs. We extend them to the second-order model.
1501.05614,0,Many information sources are considered into data fusion in order to improve the decision in terms of uncertainty and imprecision. For each technique used for data fusion, the asumption on independance is usually made. We propose in this article an approach to take into acount an independance measure befor to make the combination of information in the context of the theory of belief functions.
1501.05677,0,We introduce an adaptive output-sensitive Metropolis-Hastings algorithm for probabilistic models expressed as programs, Adaptive Lightweight Metropolis-Hastings (AdLMH). The algorithm extends Lightweight Metropolis-Hastings (LMH) by adjusting the probabilities of proposing random variables for modification to improve convergence of the program output. We show that AdLMH converges to the correct equilibrium distribution and compare convergence of AdLMH to that of LMH on several test problems to highlight different aspects of the adaptation scheme. We observe consistent improvement in convergence on the test problems.
1501.05724,0,Considering the high heterogeneity of the ontologies pub-lished on the web, ontology matching is a crucial issue whose aim is to establish links between an entity of a source ontology and one or several entities from a target ontology. Perfectible similarity measures, consid-ered as sources of information, are combined to establish these links. The theory of belief functions is a powerful mathematical tool for combining such uncertain information. In this paper, we introduce a decision pro-cess based on a distance measure to identify the best possible matching entities for a given source entity.
1501.05882,0,This paper concerns the single machine total weighted tardiness scheduling with sequence-dependent setup times, usually referred as $1|s_{ij}|\sum w_jT_j$. In this $\mathcal{NP}$-hard problem, each job has an associated processing time, due date and a weight. For each pair of jobs $i$ and $j$, there may be a setup time before starting to process $j$ in case this job is scheduled immediately after $i$. The objective is to determine a schedule that minimizes the total weighted tardiness, where the tardiness of a job is equal to its completion time minus its due date, in case the job is completely processed only after its due date, and is equal to zero otherwise. Due to its complexity, this problem is most commonly solved by heuristics. The aim of this work is to develop a simple yet effective limitation strategy that speeds up the local search procedure without a significant loss in the solution quality. Such strategy consists of a filtering mechanism that prevents unpromising moves to be evaluated. The proposed strategy has been embedded in a local search based metaheuristic from the literature and tested in classical benchmark instances. Computational experiments revealed that the limitation strategy enabled the metaheuristic to be extremely competitive when compared to other algorithms from the literature, since it allowed the use of a large number of neighborhood structures without a significant increase in the CPU time and, consequently, high quality solutions could be achieved in a matter of seconds. In addition, we analyzed the effectiveness of the proposed strategy in two other well-known metaheuristics. Further experiments were also carried out on benchmark instances of problem $1|s_{ij}|\sum T_j$.
1501.05917,0,The article is dedicated to the analysis of the existing models for assessment based of the fuzzy logic centroid technique. A new Generalized Rectangular Model were developed. Some generalizations of the existing models are offered.
