1501.05940,0,Web services allow communication between heterogeneous systems in a distributed environment. Their enormous success and their increased use led to the fact that thousands of Web services are present on the Internet. This significant number of Web services which not cease to increase has led to problems of the difficulty in locating and classifying web services, these problems are encountered mainly during the operations of web services discovery and substitution. Traditional ways of search based on keywords are not successful in this context, their results do not support the structure of Web services and they consider in their search only the identifiers of the web service description language (WSDL) interface elements. The methods based on semantics (WSDLS, OWLS, SAWSDL...) which increase the WSDL description of a Web service with a semantic description allow raising partially this problem, but their complexity and difficulty delays their adoption in real cases. Measuring the similarity between the web services interfaces is the most suitable solution for this kind of problems, it will classify available web services so as to know those that best match the searched profile and those that do not match. Thus, the main goal of this work is to study the degree of similarity between any two web services by offering a new method that is more effective than existing works.
1501.06595,0,In the domain of online advertising, our aim is to serve the best ad to a user who visits a certain webpage, to maximize the chance of a desired action to be performed by this user after seeing the ad. While it is possible to generate a different prediction model for each user to tell if he/she will act on a given ad, the prediction result typically will be quite unreliable with huge variance, since the desired actions are extremely sparse, and the set of users is huge (hundreds of millions) and extremely volatile, i.e., a lot of new users are introduced everyday, or are no longer valid. In this paper we aim to improve the accuracy in finding users who will perform the desired action, by assigning each user to a cluster, where the number of clusters is much smaller than the number of users (in the order of hundreds). Each user will fall into the same cluster with another user if their event history are similar. For this purpose, we modify the probabilistic latent semantic analysis (pLSA) model by assuming the independence of the user and the cluster id, given the history of events. This assumption helps us to identify a cluster of a new user without re-clustering all the users. We present the details of the algorithm we employed as well as the distributed implementation on Hadoop, and some initial results on the clusters that were generated by the algorithm.
1501.06705,0,Defining and modeling the relation of inclusion between continuous belief function may be considered as an important operation in order to study their behaviors. Within this paper we will propose and present two forms of inclusion: The strict and the partial one. In order to develop this relation, we will study the case of consonant belief function. To do so, we will simulate normal distributions allowing us to model and analyze these relations. Based on that, we will determine the parameters influencing and characterizing the two forms of inclusion.
1501.07008,0,Belief function theory provides a flexible way to combine information provided by different sources. This combination is usually followed by a decision making which can be handled by a range of decision rules. Some rules help to choose the most likely hypothesis. Others allow that a decision is made on a set of hypotheses. In [6], we proposed a decision rule based on a distance measure. First, in this paper, we aim to demonstrate that our proposed decision rule is a particular case of the rule proposed in [4]. Second, we give experiments showing that our rule is able to decide on a set of hypotheses. Some experiments are handled on a set of mass functions generated randomly, others on real databases.
1501.07250,0,This paper proposes FMAP (Forward Multi-Agent Planning), a fully-distributed multi-agent planning method that integrates planning and coordination. Although FMAP is specifically aimed at solving problems that require cooperation among agents, the flexibility of the domain-independent planning model allows FMAP to tackle multi-agent planning tasks of any type. In FMAP, agents jointly explore the plan space by building up refinement plans through a complete and flexible forward-chaining partial-order planner. The search is guided by $h_{DTG}$, a novel heuristic function that is based on the concepts of Domain Transition Graph and frontier state and is optimized to evaluate plans in distributed environments. Agents in FMAP apply an advanced privacy model that allows them to adequately keep private information while communicating only the data of the refinement plans that is relevant to each of the participating agents. Experimental results show that FMAP is a general-purpose approach that efficiently solves tightly-coupled domains that have specialized agents and cooperative goals as well as loosely-coupled problems. Specifically, the empirical evaluation shows that FMAP outperforms current MAP systems at solving complex planning tasks that are adapted from the International Planning Competition benchmarks.
1501.07256,0,Multi-agent planning (MAP) approaches have been typically conceived for independent or loosely-coupled problems to enhance the benefits of distributed planning between autonomous agents as solving this type of problems require less coordination between the agents' sub-plans. However, when it comes to tightly-coupled agents' tasks, MAP has been relegated in favour of centralized approaches and little work has been done in this direction. In this paper, we present a general-purpose MAP capable to efficiently handle planning problems with any level of coupling between agents. We propose a cooperative refinement planning approach, built upon the partial-order planning paradigm, that allows agents to work with incomplete information and to have incomplete views of the world, i.e. being ignorant of other agents' information, as well as maintaining their own private information. We show various experiments to compare the performance of our system with a distributed CSP-based MAP approach over a suite of problems.
1501.07423,0,Multi-agent planning (MAP) approaches are typically oriented at solving loosely-coupled problems, being ineffective to deal with more complex, strongly-related problems. In most cases, agents work under complete information, building complete knowledge bases. The present article introduces a general-purpose MAP framework designed to tackle problems of any coupling levels under incomplete information. Agents in our MAP model are partially unaware of the information managed by the rest of agents and share only the critical information that affects other agents, thus maintaining a distributed vision of the task.
1501.01086,0,The Generational Garbage collection involves organizing the heap into different divisions of memory space in-order to filter long-lived objects from short-lived objects through moving the surviving object of each generation Garbage Collection cycle to another memory space updating its age and reclaiming space from the dead ones. The problem in this method is that the longer an object is alive during its initial generations the longer the garbage collector will have to deal with it by checking for its reachability from the root and promoting it to other space divisions where as the ultimate goal of the Garbage Collector is to reclaim memory from unreachable objects at a minimal time possible. This paper is a proposal of a method where the lifetime of every object getting into the heap will be predicted and will be placed in heap accordingly for the garbage collector to deal more with reclaiming space from dead objects and less in promoting the live ones to the higher level.
1501.01576,0,With the fast development of communication and multimedia technology, the rights of the owners of multimedia products is vulnerable to the unauthorized copies and watermarking is one of the best known methods for proving the ownership of a product. In this paper we prosper the previous watermarking method which was based on Tabu search by Chaos. The modification applied in the permutation step of watermarking and the initial population generation of the Tabu search. We analyze our method on some well known images and experimental results shows the improvement in the quality and speed of the proposed watermarking method.
1501.01678,0,LeoTask is a Java library for computation-intensive and time-consuming research tasks. It automatically executes tasks in parallel on multiple CPU cores on a computing facility. It uses a configuration file to enable automatic exploration of parameter space and flexible aggregation of results, and therefore allows researchers to focus on programming the key logic of a computing task. It also supports reliable recovery from interruptions, dynamic and cloneable networks, and integration with the plotting software Gnuplot.
1501.02036,0,This work presents how persistent predicates have been included in the in-memory deductive system DES by relying on external SQL database management systems. We introduce how persistence is supported from a user-point of view and the possible applications the system opens up, as the deductive expressive power is projected to relational databases. Also, we describe how it is possible to intermix computations of the deductive engine and the external database, explaining its implementation and some optimizations. Finally, a performance analysis is undertaken, comparing the system with current relational database systems.
1501.02192,0,Chaos provides many interesting properties that can be used to achieve computational tasks. Such properties are sensitivity to initial conditions, space filling, control and synchronization. Chaotic neural models have been devised to exploit such properties. In this paper, a chaotic spiking neuron model is investigated experimentally. This investigation is performed to understand the dynamic behaviours of the model.
The aim of this research is to investigate the dynamics of the nonlinear dynamic state neuron (NDS) experimentally. The experimental approach has revealed some quantitative and qualitative properties of the NDS model such as the control mechanism, the reset mechanism, and the way the model may exhibit dynamic behaviours in phase space. It is shown experimentally in this paper that both the reset mechanism and the self-feed back control mechanism are important for the NDS model to work and to stabilise to one of the large number of available unstable periodic orbits (UPOs) that are embedded in its attractor. The experimental investigation suggests that the internal dynamics of the NDS neuron provide a rich set of dynamic behaviours that can be controlled and stabilised. These wide range of dynamic behaviours may be exploited to carry out information processing tasks.
1501.02527,0,Topic models are a way to discover underlying themes in an otherwise unstructured collection of documents. In this study, we specifically used the Latent Dirichlet Allocation (LDA) topic model on a dataset of Yelp reviews to classify restaurants based off of their reviews. Furthermore, we hypothesize that within a city, restaurants can be grouped into similar "clusters" based on both location and similarity. We used several different clustering methods, including K-means Clustering and a Probabilistic Mixture Model, in order to uncover and classify districts, both well-known and hidden (i.e. cultural areas like Chinatown or hearsay like "the best street for Italian restaurants") within a city. We use these models to display and label different clusters on a map. We also introduce a topic similarity heatmap that displays the similarity distribution in a city to a new restaurant.
1501.02662,0,Participatory democracy advances in virtually all governments and especially in South America which exhibits a mixed culture and social predisposition. This article presents the "Social Participation Ontology" (OPS from the Brazilian name \emph{Ontologia de Participação Social}) implemented in compliance with the Web Ontology Language standard (OWL) for fostering social participation, specially in virtual platforms. The entities and links of OPS were defined based on an extensive collaboration of specialists. It is shown that OPS is instrumental for information retrieval from the contents of the portal, both in terms of the actors (at various levels) as well as mechanisms and activities. Significantly, OPS is linked to other OWL ontologies as an upper ontology and via FOAF and BFO as higher upper ontologies, which yields sound organization and access of knowledge and data. In order to illustrate the usefulness of OPS, we present results on ontological expansion and integration with other ontologies and data. Ongoing work involves further adoption of OPS by the official Brazilian federal portal for social participation and NGO s, and further linkage to other ontologies for social participation.
1501.04358,0,Shannon's information entropy measures of the uncertainty of an event's outcome. If learning about a system reflects a decrease in uncertainty, then a plausible intuition is that learning should be accompanied by a decrease in the entropy of the organism's actions and/or perceptual states. To address whether this intuition is valid, I examined an artificial organism -- a simple robot -- that learned to navigate in an arena and analyzed the entropy of the outcome variables action, state, and reward. Entropy did indeed decrease in the initial stages of learning, but two factors complicated the scenario: (1) the introduction of new options discovered during the learning process and (2) the shifting patterns of perceptual and environmental states resulting from changes to the robot's learned movement strategies. These factors lead to a subsequent increase in entropy as the agent learned. I end with a discussion of the utility of information-based characterizations of learning.
1501.04792,0,The purpose of this study is to provide an accessibility measure of web-pages, in order to draw disabled users to the pages that have been designed to be ac-cessible to them. Our approach is based on the theory of belief functions, using data which are supplied by reports produced by automatic web content assessors that test the validity of criteria defined by the WCAG 2.0 guidelines proposed by the World Wide Web Consortium (W3C) organization. These tools detect errors with gradual degrees of certainty and their results do not always converge. For these reasons, to fuse information coming from the reports, we choose to use an information fusion framework which can take into account the uncertainty and imprecision of infor-mation as well as divergences between sources. Our accessibility indicator covers four categories of deficiencies. To validate the theoretical approach in this context, we propose an evaluation completed on a corpus of 100 most visited French news websites, and 2 evaluation tools. The results obtained illustrate the interest of our accessibility indicator.
1501.04832,0,Very large data sets are the common rule in automated mapping, GIS, remote sensing, and what we can name geo-information. Indeed, in 1983 Landsat was already delivering gigabytes of data, and other sensors were in orbit or ready for launch, and a tantamount of cartographic data was being digitized. The retrospective paper revisits several issues that geo-information sciences had to face from the early stages on, including: structure ( to bring some structure to the data registered from a sampled signal, metadata); processing (huge amounts of data for big computers and fast algorithms); uncertainty (the kinds of errors, their quantification); consistency (when merging different sources of data is logically allowed, and meaningful); ontologies (clear and agreed shared definitions, if any kind of decision should be based upon them). All these issues are the background of Internet queries, and the underlying technology has been shaped during those years when geo-information engineering emerged.
1501.05290,0,In view of the paradigm shift that makes science ever more data-driven, in this thesis we propose a synthesis method for encoding and managing large-scale deterministic scientific hypotheses as uncertain and probabilistic data.
In the form of mathematical equations, hypotheses symmetrically relate aspects of the studied phenomena. For computing predictions, however, deterministic hypotheses can be abstracted as functions. We build upon Simon's notion of structural equations in order to efficiently extract the (so-called) causal ordering between variables, implicit in a hypothesis structure (set of mathematical equations).
We show how to process the hypothesis predictive structure effectively through original algorithms for encoding it into a set of functional dependencies (fd's) and then performing causal reasoning in terms of acyclic pseudo-transitive reasoning over fd's. Such reasoning reveals important causal dependencies implicit in the hypothesis predictive data and guide our synthesis of a probabilistic database. Like in the field of graphical models in AI, such a probabilistic database should be normalized so that the uncertainty arisen from competing hypotheses is decomposed into factors and propagated properly onto predictive data by recovering its joint probability distribution through a lossless join. That is motivated as a design-theoretic principle for data-driven hypothesis management and predictive analytics.
The method is applicable to both quantitative and qualitative deterministic hypotheses and demonstrated in realistic use cases from computational science.
1501.05426,0,Nowadays, social networks such as Twitter, Facebook and LinkedIn become increasingly popular. In fact, they introduced new habits, new ways of communication and they collect every day several information that have different sources. Most existing research works fo-cus on the analysis of homogeneous social networks, i.e. we have a single type of node and link in the network. However, in the real world, social networks offer several types of nodes and links. Hence, with a view to preserve as much information as possible, it is important to consider so-cial networks as heterogeneous and uncertain. The goal of our paper is to classify the social message based on its spreading in the network and the theory of belief functions. The proposed classifier interprets the spread of messages on the network, crossed paths and types of links. We tested our classifier on a real word network that we collected from Twitter, and our experiments show the performance of our belief classifier.
1501.06206,0,The dynamics of belief and knowledge is one of the major components of any autonomous system that should be able to incorporate new pieces of information. In order to apply the rationality result of belief dynamics theory to various practical problems, it should be generalized in two respects: first it should allow a certain part of belief to be declared as immutable; and second, the belief state need not be deductively closed. Such a generalization of belief dynamics, referred to as base dynamics, is presented in this paper, along with the concept of a generalized revision algorithm for knowledge bases (Horn or Horn logic with stratified negation). We show that knowledge base dynamics has an interesting connection with kernel change via hitting set and abduction. In this paper, we show how techniques from disjunctive logic programming can be used for efficient (deductive) database updates. The key idea is to transform the given database together with the update request into a disjunctive (datalog) logic program and apply disjunctive techniques (such as minimal model reasoning) to solve the original update problem. The approach extends and integrates standard techniques for efficient query answering and integrity checking. The generation of a hitting set is carried out through a hyper tableaux calculus and magic set that is focused on the goal of minimality. The present paper provides a comparative study of view update algorithms in rational approach. For, understand the basic concepts with abduction, we provide an abductive framework for knowledge base dynamics. Finally, we demonstrate how belief base dynamics can provide an axiomatic characterization for insertion a view atom to the database. We give a quick overview of the main operators for belief change, in particular, belief update versus database update.
1501.02315,0,Planned experiments are the gold standard in reliably comparing the causal effect of switching from a baseline policy to a new policy. One critical shortcoming of classical experimental methods, however, is that they typically do not take into account the dynamic nature of response to policy changes. For instance, in an experiment where we seek to understand the effects of a new ad pricing policy on auction revenue, agents may adapt their bidding in response to the experimental pricing changes. Thus, causal effects of the new pricing policy after such adaptation period, the {\em long-term causal effects}, are not captured by the classical methodology even though they clearly are more indicative of the value of the new policy. Here, we formalize a framework to define and estimate long-term causal effects of policy changes in multiagent economies. Central to our approach is behavioral game theory, which we leverage to formulate the ignorability assumptions that are necessary for causal inference. Under such assumptions we estimate long-term causal effects through a latent space approach, where a behavioral model of how agents act conditional on their latent behaviors is combined with a temporal model of how behaviors evolve over time.
1501.04346,0,While computer and communication technologies have provided effective means to scale up many aspects of education, the submission and grading of assessments such as homework assignments and tests remains a weak link. In this paper, we study the problem of automatically grading the kinds of open response mathematical questions that figure prominently in STEM (science, technology, engineering, and mathematics) courses. Our data-driven framework for mathematical language processing (MLP) leverages solution data from a large number of learners to evaluate the correctness of their solutions, assign partial-credit scores, and provide feedback to each learner on the likely locations of any errors. MLP takes inspiration from the success of natural language processing for text data and comprises three main steps. First, we convert each solution to an open response mathematical question into a series of numerical features. Second, we cluster the features from several solutions to uncover the structures of correct, partially correct, and incorrect solutions. We develop two different clustering approaches, one that leverages generic clustering algorithms and one based on Bayesian nonparametrics. Third, we automatically grade the remaining (potentially large number of) solutions based on their assigned cluster and one instructor-provided grade per cluster. As a bonus, we can track the cluster assignment of each step of a multistep solution and determine when it departs from a cluster of correct solutions, which enables us to indicate the likely locations of errors to learners. We test and validate MLP on real-world MOOC data to demonstrate how it can substantially reduce the human effort required in large-scale educational platforms.
1501.04413,0,In this paper, we present a statistical-mechanical analysis of deep learning. We elucidate some of the essential components of deep learning---pre-training by unsupervised learning and fine tuning by supervised learning. We formulate the extraction of features from the training data as a margin criterion in a high-dimensional feature-vector space. The self-organized classifier is then supplied with small amounts of labelled data, as in deep learning. Although we employ a simple single-layer perceptron model, rather than directly analyzing a multi-layer neural network, we find a nontrivial phase transition that is dependent on the number of unlabelled data in the generalization error of the resultant classifier. In this sense, we evaluate the efficacy of the unsupervised learning component of deep learning. The analysis is performed by the replica method, which is a sophisticated tool in statistical mechanics. We validate our result in the manner of deep learning, using a simple iterative algorithm to learn the weight vector on the basis of belief propagation.
1501.05215,0,Bayesian Networks (BNs) are popular graphical models for the representation of statistical problems embodying dependence relationships between a number of variables. Much of this popularity is due to the d-separation theorem of Pearl and Lauritzen, which allows an analyst to identify the conditional independence statements that a model of the problem embodies using only the topology of the graph. However for many problems the complete model dependence structure cannot be depicted by a BN. The Chain Event Graph (CEG) was introduced for these types of problem. In this paper we introduce a separation theorem for CEGs, analogous to the d-separation theorem for BNs, which likewise allows an analyst to identify the conditional independence structure of their model from the topology of the graph.
